{
  "source": "inline",
  "chars": 66,
  "words": 11,
  "watermark_verification": {
    "provider": "none",
    "status": "not_requested",
    "verified": null,
    "score": null,
    "reason": "Provider watermark verification was not requested.",
    "method": "none",
    "evidence_level": "unavailable",
    "metadata": {}
  },
  "unicode_forensics": {
    "suspicious_count": 0,
    "findings": [],
    "mixed_script_count": 0,
    "mixed_script_findings": [],
    "families": {},
    "normalisation": {
      "nfc_changes": false,
      "nfkc_changes": false,
      "nfc_delta_chars": 0,
      "nfkc_delta_chars": 0,
      "note": "Unicode normalisation differences can be legitimate typography. They are reported as forensic observations, not provenance proof."
    },
    "note": "Observable Unicode artefacts can reveal hidden or unusual text channels, but they are not equivalent to provider watermarks."
  },
  "stylometry": {
    "classification": "heuristic_only",
    "token_count": 11,
    "sentence_count": 2,
    "signals": [
      {
        "name": "type_token_ratio",
        "value": 1.0,
        "interpretation": "Vocabulary diversity metric only; not an AI or watermark test.",
        "kind": "metric"
      },
      {
        "name": "sentence_length_cv",
        "value": 0.0909,
        "interpretation": "Variation in sentence length; both human and AI writing span the full range.",
        "kind": "metric"
      },
      {
        "name": "repeated_trigram_types",
        "value": 0,
        "interpretation": "Counts repeated three-word sequences; repetition alone does not identify authorship.",
        "kind": "metric"
      }
    ],
    "flagged_signal_count": 0,
    "note": "Stylometry describes writing patterns. It is not a provider watermark detector and cannot prove AI authorship."
  },
  "c2pa": {
    "status": "not_applicable",
    "manifest_present": null,
    "validation_ok": null,
    "active_manifest": null,
    "claim_generator": null,
    "digital_source_types": [],
    "assertion_labels": [],
    "provider_hints": [],
    "validation_status": [],
    "backend": null,
    "reason": "C2PA inspection applies to supported files, not raw pasted text.",
    "note": "C2PA can provide signed, tamper-evident provenance for supported assets. A valid manifest is evidence about an asset history, not proof that every word was originally authored by a named model."
  },
  "segments": [],
  "evidence_summary": {
    "overall_level": "no_positive_evidence",
    "provider_verification": "not_requested",
    "signed_file_provenance": "not_applicable",
    "observable_text_forensics": "none_observed",
    "style_heuristics": "metrics_only",
    "interpretation": "No positive provenance evidence was established by the configured checks. Absence of evidence is not evidence of human authorship.",
    "note": "This is an evidence-strength classification, not a probability that text was AI-generated."
  },
  "evidence_scores": {
    "provider_evidence": null,
    "signed_provenance": null,
    "observable_text_anomalies": 0,
    "style_heuristics": 0,
    "note": "Scores describe strength within separate evidence channels. They must not be added together or interpreted as an AI-authorship probability."
  },
  "limitations": [
    "A provider watermark is not the same as generic AI-style detection.",
    "Short samples usually provide less signal than long passages.",
    "Absence of a detectable mark does not prove human authorship or absence of AI processing.",
    "Unicode and stylometric findings are observational and can have ordinary non-AI explanations.",
    "C2PA proves statements bound to an asset when validation succeeds; it does not by itself prove that every word was originally generated by the named software."
  ],
  "version": "0.3.0"
}
